{
  "manifestId": "manifest-q3-exec-v1",
  "packetId": "packet-q3-executive-review",
  "version": 1,
  "createdAt": "2026-08-21T00:00:00.000Z",
  "sources": [
    {"sourceId": "src-churn", "kind": "google_sheet", "resourceId": "demo-sheet", "anchor": "Metrics!B17", "version": "sheet-v1"},
    {"sourceId": "src-churn-previous", "kind": "google_sheet", "resourceId": "demo-sheet", "anchor": "Metrics!B16", "version": "sheet-v1"},
    {"sourceId": "src-revenue", "kind": "google_sheet", "resourceId": "demo-sheet", "anchor": "Metrics!B5", "version": "sheet-v1"},
    {"sourceId": "src-pipeline", "kind": "google_sheet", "resourceId": "demo-sheet", "anchor": "Metrics!B8", "version": "sheet-v1"},
    {"sourceId": "src-nps", "kind": "google_sheet", "resourceId": "demo-sheet", "anchor": "Metrics!B20", "version": "sheet-v1"},
    {"sourceId": "src-launch", "kind": "google_doc", "resourceId": "demo-policy-doc", "anchor": "launch-date", "version": "doc-v1"}
  ],
  "artifacts": [
    {"artifactId": "artifact-board-memo", "kind": "google_doc", "resourceId": "demo-board-memo", "baseRevisionId": "board-memo-v1", "mutability": "editable"},
    {"artifactId": "artifact-exec-deck", "kind": "google_slides", "resourceId": "demo-exec-deck", "baseRevisionId": "exec-deck-v1", "mutability": "editable"},
    {"artifactId": "artifact-investor-email", "kind": "gmail", "resourceId": "demo-sent-email", "baseRevisionId": "sent-email-v1", "mutability": "immutable"},
    {"artifactId": "artifact-acquisition-task", "kind": "google_task", "resourceId": "demo-acquisition-task", "baseRevisionId": "acquisition-task-v1", "mutability": "editable"},
    {"artifactId": "artifact-retention-plan", "kind": "google_doc", "resourceId": "demo-retention-plan", "baseRevisionId": "retention-plan-v1", "mutability": "editable"}
  ],
  "claims": [
    {
      "claimId": "claim-churn-value",
      "statement": "Q3 customer churn is 4%.",
      "sourceIds": ["src-churn"],
      "artifactAnchors": [{"artifactId": "artifact-board-memo", "anchor": "claim-churn-value"}, {"artifactId": "artifact-exec-deck", "anchor": "shape-churn-value"}],
      "transformation": {"name": "identity_percent", "version": "1", "parameters": {"prefix": "Q3 customer churn is "}},
      "risk": "reversible",
      "provenance": "registered",
      "freshnessHours": 24
    },
    {
      "claimId": "claim-churn-improved",
      "statement": "Customer churn improved during Q3.",
      "sourceIds": ["src-churn", "src-churn-previous"],
      "artifactAnchors": [{"artifactId": "artifact-board-memo", "anchor": "claim-churn-improved"}, {"artifactId": "artifact-investor-email", "anchor": "claim-churn-improved"}],
      "transformation": {"name": "compare_to_previous_quarter", "version": "1", "parameters": {"whenLower": "Customer churn improved during Q3.", "whenHigher": "Customer churn worsened during Q3.", "whenEqual": "Customer churn was unchanged during Q3."}},
      "risk": "reversible",
      "provenance": "registered",
      "freshnessHours": 24
    },
    {
      "claimId": "claim-retention-target",
      "statement": "The retention target has been achieved.",
      "sourceIds": ["src-churn"],
      "artifactAnchors": [{"artifactId": "artifact-exec-deck", "anchor": "shape-retention-target"}, {"artifactId": "artifact-retention-plan", "anchor": "claim-retention-target"}],
      "transformation": {"name": "churn_lte_target_5_percent", "version": "1", "parameters": {"target": 0.05, "whenTrue": "The retention target has been achieved.", "whenFalse": "The retention target has not been achieved."}},
      "risk": "decision_changing",
      "provenance": "registered",
      "freshnessHours": 24
    },
    {
      "claimId": "claim-scale-acquisition",
      "statement": "The company should increase acquisition spend.",
      "sourceIds": ["src-churn"],
      "artifactAnchors": [{"artifactId": "artifact-exec-deck", "anchor": "shape-acquisition-recommendation"}, {"artifactId": "artifact-investor-email", "anchor": "claim-acquisition-recommendation"}, {"artifactId": "artifact-acquisition-task", "anchor": "task-body"}],
      "transformation": {"name": "recommend_if_churn_lte_5_percent", "version": "1", "parameters": {"target": 0.05, "whenTrue": "The company should increase acquisition spend.", "whenFalse": "The company should pause the planned increase in acquisition spend."}},
      "risk": "decision_changing",
      "provenance": "registered",
      "freshnessHours": 24
    },
    {
      "claimId": "claim-revenue",
      "statement": "Q3 revenue is $12M.",
      "sourceIds": ["src-revenue"],
      "artifactAnchors": [{"artifactId": "artifact-board-memo", "anchor": "claim-revenue"}],
      "transformation": {"name": "identity_currency_millions", "version": "1", "parameters": {"prefix": "Q3 revenue is "}},
      "risk": "reversible",
      "provenance": "registered",
      "freshnessHours": 24
    },
    {
      "claimId": "claim-pipeline",
      "statement": "The qualified pipeline is $18M.",
      "sourceIds": ["src-pipeline"],
      "artifactAnchors": [{"artifactId": "artifact-exec-deck", "anchor": "shape-pipeline"}],
      "transformation": {"name": "identity_currency_millions", "version": "1", "parameters": {"prefix": "The qualified pipeline is "}},
      "risk": "reversible",
      "provenance": "registered",
      "freshnessHours": 24
    },
    {
      "claimId": "claim-nps",
      "statement": "Net Promoter Score is 62.",
      "sourceIds": ["src-nps"],
      "artifactAnchors": [{"artifactId": "artifact-retention-plan", "anchor": "claim-nps"}],
      "transformation": {"name": "identity_number", "version": "1", "parameters": {"prefix": "Net Promoter Score is "}},
      "risk": "reversible",
      "provenance": "registered",
      "freshnessHours": 24
    },
    {
      "claimId": "claim-launch-date",
      "statement": "The product launch remains scheduled for October 15.",
      "sourceIds": ["src-launch"],
      "artifactAnchors": [{"artifactId": "artifact-board-memo", "anchor": "claim-launch-date"}],
      "transformation": {"name": "identity_date", "version": "1", "parameters": {"prefix": "The product launch remains scheduled for "}},
      "risk": "decision_changing",
      "provenance": "registered",
      "freshnessHours": 168
    }
  ]
}
